### DISCUSSION TITLE
Connected CIP adapter

### DISCUSSION THREAD

**Discussion by ASolchen** [ottowayi/pycomm3#189] [Q&A]
Just out of curiosity, is it possible to use the CIPDriver to connect using "connected" method? I haven't read the EIP docs, but did take a wireshark capture of a PLC connecting and controlling an EIP Stepper driver. It is pretty interesting. It seems to connect using TCP on port 44818 at first and then switches to UDP on port 2222 and sends data / get responses at the RPI intervals. I looked through the socket_.py file and see it only uses 'socket.socket(socket.AF_INET, socket.SOCK_STREAM)' A UDP socket would be like 'socket.socket(socket.AF_INET, socket.SOCK_DGRAM)' so I'm guessing it is not possible at this point. Is this correct? Would this be a lot of work to add?

**Comment by ASolchen** [comment]
Also if anyone is interested in the .pcapng capture file, let me know. Here's how it looks:

22	30.810125	Rockwell_f2:ee:84	Broadcast	ARP	60	Who has 192.168.0.50? Tell 192.168.0.5
23	30.810127	Advanced_0f:74	Rockwell_f2:ee:84	ARP	60	192.168.0.50 is at c8:8e:d1:b0:0f:74
24	30.810127	192.168.0.5	192.168.0.50	TCP	66	63972 → 44818 [SYN] Seq=0 Win=8192 Len=0 MSS=1460 SACK_PERM=1 WS=1
25	30.810128	192.168.0.50	192.168.0.5	TCP	60	44818 → 63972 [SYN, ACK] Seq=0 Ack=1 Win=5840 Len=0 MSS=1460
26	30.810128	192.168.0.5	192.168.0.50	TCP	60	63972 → 44818 [ACK] Seq=1 Ack=1 Win=8192 Len=0
27	30.810129	192.168.0.5	192.168.0.50	ENIP	82	Register Session (Req), Session: 0x00000000
28	30.810758	192.168.0.50	192.168.0.5	ENIP	82	Register Session (Rsp), Session: 0x00000001
29	30.810759	192.168.0.5	192.168.0.50	TCP	60	63972 → 44818 [ACK] Seq=29 Ack=29 Win=8164 Len=0
30	30.810760	192.168.0.5	192.168.0.50	CIP CM	172	Connection Manager - Forward Open (Assembly)
31	30.813225	192.168.0.50	192.168.0.5	CIP CM	144	Success: Connection Manager - Forward Open (Assembly)
32	30.813227	192.168.0.5	192.168.0.50	TCP	60	63972 → 44818 [ACK] Seq=147 Ack=119 Win=8102 Len=0
33	30.813228	192.168.0.50	192.168.0.5	CIP I/O	82	Connection: ID=0x001B4413, SEQ=0000000000, T->O
34	30.813386	192.168.0.5	192.168.0.50	CIP I/O	86	Connection: ID=0xD0740016, SEQ=0000000000, O->T
35	30.819759	192.168.0.50	192.168.0.5	CIP I/O	82	Connection: ID=0x001B4413, SEQ=0000000001, T->O
